{
  "$schema": "https://json-schema.org/draft/2020-12/schema",
  "$id": "https://assess.avd-ops.dev/schemas/avd-assess-endpoints/v1.json",
  "title": "avd-assess-endpoints/v1: the AVD endpoint map (endpoints.json)",
  "description": "Contract C20's fourth document, generated by avd-assess from endpoints.yaml and checked fresh by its CI. One row per endpoint a family tool probes or reports as not tested, each pointing at the pinned Learn claim that lists it; Microsoft's page stays the source of truth, and addresses and ranges are never restated (a row names the service tag instead). Rows add where a probe means something (probeFrom), whether a tool's overall verdict counts a failure (verdict) and the kind of target. Only concrete names (kind fqdn) carry a probeFrom. Readers vendor this file at an avd-assess commit with its SHA-256, never fetch it at run time, ignore fields they don't know, and treat a probe from a vantage not in probeFrom as unknown. Renaming or removing a row bumps version.",
  "type": "object",
  "required": [
    "schema",
    "version",
    "cloud",
    "readAt",
    "lists",
    "endpoints",
    "views"
  ],
  "additionalProperties": false,
  "$defs": {
    "slug": {
      "type": "string",
      "pattern": "^[a-z0-9][a-z0-9.-]{1,63}$"
    },
    "claim": {
      "type": "string",
      "pattern": "^ref:[a-z0-9-]+#[a-z0-9-]+$"
    },
    "vantage": {
      "enum": [
        "browser",
        "device",
        "host"
      ]
    },
    "source": {
      "type": "object",
      "required": [
        "claim",
        "url",
        "pin"
      ],
      "additionalProperties": false,
      "properties": {
        "claim": {
          "$ref": "#/$defs/claim"
        },
        "url": {
          "type": "string",
          "pattern": "^https://"
        },
        "pin": {
          "type": "string",
          "description": "The reference's immutable pin, as references/ writes it (a Learn page's git_commit_id and updated_at)."
        }
      }
    },
    "idList": {
      "type": "array",
      "items": {
        "type": "string"
      },
      "uniqueItems": true
    },
    "view": {
      "type": "object",
      "required": [
        "lists",
        "probe",
        "notTested"
      ],
      "additionalProperties": false,
      "properties": {
        "lists": {
          "$ref": "#/$defs/idList",
          "description": "The lists this vantage judges."
        },
        "probe": {
          "$ref": "#/$defs/idList",
          "description": "Rows of those lists this vantage may probe."
        },
        "notTested": {
          "$ref": "#/$defs/idList",
          "description": "Every other row of those lists, for a tool's 'not tested' list."
        }
      }
    },
    "deprecated": {
      "type": "object",
      "description": "Marks an ID that a later major release may remove (docs/distribution-spec.md section 6): the release that first carried the mark and the ID that replaces it, if any. Readers keep using a deprecated ID until it is gone.",
      "required": [
        "since"
      ],
      "additionalProperties": false,
      "properties": {
        "since": {
          "type": "string",
          "pattern": "^(0|[1-9][0-9]*)\\.(0|[1-9][0-9]*)\\.(0|[1-9][0-9]*)$"
        },
        "replacedBy": {
          "type": [
            "string",
            "null"
          ]
        }
      }
    }
  },
  "properties": {
    "$schema": {
      "type": "string"
    },
    "schema": {
      "const": "avd-assess-endpoints/v1"
    },
    "version": {
      "type": "integer",
      "minimum": 1
    },
    "cloud": {
      "enum": [
        "azure-public"
      ],
      "description": "One map per cloud; other clouds are an extension point."
    },
    "readAt": {
      "type": "object",
      "description": "Reference id to the Learn git_commit_id the rows were read at.",
      "additionalProperties": {
        "type": "string",
        "pattern": "^[0-9a-f]{40}$"
      },
      "minProperties": 1
    },
    "lists": {
      "type": "array",
      "minItems": 1,
      "items": {
        "type": "object",
        "required": [
          "id",
          "title",
          "claim",
          "dimension",
          "source"
        ],
        "additionalProperties": false,
        "properties": {
          "id": {
            "$ref": "#/$defs/slug"
          },
          "title": {
            "type": "string",
            "minLength": 1
          },
          "claim": {
            "$ref": "#/$defs/claim"
          },
          "dimension": {
            "$ref": "#/$defs/slug",
            "description": "The map row (dimensions.yaml) this list measures."
          },
          "source": {
            "$ref": "#/$defs/source"
          },
          "deprecated": {
            "$ref": "#/$defs/deprecated"
          }
        }
      }
    },
    "endpoints": {
      "type": "array",
      "minItems": 1,
      "items": {
        "type": "object",
        "required": [
          "id",
          "list",
          "kind",
          "protocol",
          "port",
          "purpose",
          "verdict",
          "probeFrom",
          "source"
        ],
        "additionalProperties": false,
        "properties": {
          "id": {
            "$ref": "#/$defs/slug"
          },
          "list": {
            "$ref": "#/$defs/slug"
          },
          "kind": {
            "enum": [
              "fqdn",
              "wildcard",
              "range",
              "address"
            ]
          },
          "host": {
            "type": "string",
            "pattern": "^(\\*\\.)?[a-z0-9]([a-z0-9-]*[a-z0-9])?(\\.[a-z0-9]([a-z0-9-]*[a-z0-9])?)+$",
            "description": "The name, for fqdn and wildcard rows only. Never an address."
          },
          "protocol": {
            "enum": [
              "tcp",
              "udp"
            ]
          },
          "port": {
            "type": "integer",
            "minimum": 1,
            "maximum": 65535
          },
          "purpose": {
            "enum": [
              "sign-in",
              "service",
              "connection-center",
              "relay",
              "certificates",
              "links-and-docs",
              "troubleshooting",
              "telemetry",
              "client-updates",
              "agent",
              "activation",
              "marketplace",
              "portal-support",
              "platform"
            ]
          },
          "verdict": {
            "enum": [
              "required",
              "informational"
            ]
          },
          "probeFrom": {
            "type": "array",
            "items": {
              "$ref": "#/$defs/vantage"
            },
            "uniqueItems": true
          },
          "serviceTag": {
            "type": "string",
            "pattern": "^[A-Za-z][A-Za-z0-9.]*$",
            "description": "Only where the cited table gives one."
          },
          "note": {
            "type": "string"
          },
          "source": {
            "$ref": "#/$defs/source"
          },
          "deprecated": {
            "$ref": "#/$defs/deprecated"
          }
        },
        "allOf": [
          {
            "if": {
              "properties": {
                "kind": {
                  "enum": [
                    "fqdn",
                    "wildcard"
                  ]
                }
              }
            },
            "then": {
              "required": [
                "host"
              ]
            },
            "else": {
              "not": {
                "required": [
                  "host"
                ]
              }
            }
          },
          {
            "if": {
              "properties": {
                "kind": {
                  "enum": [
                    "wildcard",
                    "range",
                    "address"
                  ]
                }
              }
            },
            "then": {
              "properties": {
                "probeFrom": {
                  "maxItems": 0
                }
              }
            }
          }
        ]
      }
    },
    "views": {
      "type": "object",
      "required": [
        "browser",
        "device",
        "host"
      ],
      "additionalProperties": false,
      "description": "One view per vantage, so a reader filters nothing itself.",
      "properties": {
        "browser": {
          "$ref": "#/$defs/view"
        },
        "device": {
          "$ref": "#/$defs/view"
        },
        "host": {
          "$ref": "#/$defs/view"
        }
      }
    }
  }
}
